"ID","Group","Status","Speaker","Text","File name"
1,"",0,"Microsoft Hazel Desktop","Incoming transmission from: Dr. Elglore Smankoff","Incoming Transmission Smankoff"
1,"",0,"Microsoft Hazel Desktop","Incoming transmission from: Torbar Contour","Incoming Transmission Contor"
1,"",0,"Microsoft Hazel Desktop","Incoming transmission from: ziss'sisis sis'sisis","Incoming Transmission SSSSS"
1,"",0,"Microsoft Hazel Desktop","Incoming transmission from: Smarglarff Sneet","Incoming Transmission Sneet"
1,"",0,"Microsoft Hazel Desktop","Incoming transmission from: Bloof Gloof","Incoming Transmission Gloof"
1,"",0,"Microsoft Hazel Desktop","Incoming transmission from: Zem Lips","Incoming Transmission Lips"
1,"",0,"Microsoft Hazel Desktop","Incoming transmission from: Goya Carr","Incoming Transmission Carr"
1,"",0,"Microsoft Hazel Desktop","Incoming transmission from: Mire Oodle","Incoming Transmission Oodle"